{
  "$schema": "https://json-schema.org/draft/2020-12/schema",
  "$id": "https://mncs.dev/schemas/family/repository-manifest-v0alpha1.schema.json",
  "title": "MNCS Family Repository Manifest v0alpha1",
  "description": "Declares what one family repository provides, consumes, and validates, as machine-readable contract-graph inputs. Declaring compatibility is not compatibility evidence; owning repositories remain the semantic authorities for their contracts.",
  "type": "object",
  "additionalProperties": false,
  "required": [
    "schema_version",
    "repository",
    "revision",
    "contracts"
  ],
  "properties": {
    "schema_version": {
      "const": "mncs-family.repository-manifest/v0alpha1"
    },
    "repository": {
      "type": "string",
      "pattern": "^[a-z][a-z0-9-]*$",
      "description": "Stable component id; must match the family registry component id."
    },
    "revision": {
      "type": "integer",
      "minimum": 1,
      "description": "Incremented whenever the declared surface changes meaning."
    },
    "manifest_location": {
      "enum": [
        "in-repository",
        "central"
      ],
      "default": "in-repository"
    },
    "authority": {
      "type": "object",
      "additionalProperties": false,
      "properties": {
        "note": {
          "type": "string"
        }
      }
    },
    "organization": {
      "$ref": "#/$defs/organization",
      "description": "Optional repository-owned classification of non-derived surfaces. It records only paths whose role is not reliably derivable from the manifest, source layout, and authoritative family projections."
    },
    "verification": {
      "$ref": "#/$defs/verificationDeclaration",
      "description": "Optional pointer to a repository-owned, bounded verification-obligation inventory. The inventory is a declaration surface, not an executable test database."
    },
    "contracts": {
      "type": "object",
      "additionalProperties": false,
      "required": [
        "provides",
        "consumes",
        "tests"
      ],
      "properties": {
        "provides": {
          "type": "array",
          "items": {
            "$ref": "#/$defs/providedContract"
          }
        },
        "consumes": {
          "type": "array",
          "items": {
            "$ref": "#/$defs/consumedContract"
          }
        },
        "tests": {
          "type": "array",
          "items": {
            "$ref": "#/$defs/testObligation"
          }
        }
      }
    },
    "rights_provenance_refs": {
      "type": "array",
      "items": {
        "$ref": "#/$defs/producerReference"
      },
      "description": "Carried-through references into the rights/provenance framework; this manifest does not absorb their semantics."
    },
    "projection_inventory": {
      "type": "string",
      "minLength": 1
    },
    "structure_profile": {
      "type": "object",
      "additionalProperties": false,
      "required": [
        "repository",
        "path",
        "identity"
      ],
      "properties": {
        "repository": {
          "type": "string",
          "minLength": 1
        },
        "path": {
          "type": "string",
          "minLength": 1
        },
        "identity": {
          "type": "string",
          "minLength": 1
        }
      }
    },
    "projections": {
      "type": "array",
      "maxItems": 256,
      "items": {
        "type": "object"
      },
      "description": "Legacy declaration boundary; projection semantics remain Commons/Automation/Doc owned."
    }
  },
  "$defs": {
    "version": {
      "type": "string",
      "pattern": "^v?[0-9A-Za-z][0-9A-Za-z.+_-]*$"
    },
    "providedContract": {
      "type": "object",
      "additionalProperties": false,
      "required": [
        "contract",
        "version",
        "kind",
        "stability"
      ],
      "properties": {
        "contract": {
          "type": "string",
          "pattern": "^[a-z][a-z0-9._-]*$",
          "description": "Contract name within this repository; full identity is '<repository>.<contract>/<version>'."
        },
        "version": {
          "$ref": "#/$defs/version"
        },
        "kind": {
          "type": "string",
          "description": "Free-form bounded classifier, e.g. language-profile, record-schema, protocol, module-surface."
        },
        "stability": {
          "enum": [
            "experimental",
            "stable",
            "deprecated",
            "retired"
          ]
        },
        "successor_of": {
          "type": [
            "string",
            "null"
          ],
          "description": "Full contract identity this contract supersedes."
        },
        "superseded_by": {
          "type": [
            "string",
            "null"
          ]
        },
        "fingerprint_sources": {
          "type": "array",
          "items": {
            "type": "string"
          },
          "description": "Repository-relative paths whose canonical content defines the contract surface for drift detection."
        },
        "consumers_declared": {
          "type": "array",
          "items": {
            "type": "string"
          },
          "description": "Advisory consumer list maintained by the provider; the graph is still computed from consumer manifests."
        },
        "notes": {
          "type": "string"
        },
        "invocation": {
          "type": "object"
        },
        "native_policy": {
          "type": "object"
        },
        "resident_adapter": {
          "type": "object"
        },
        "output_scope": {
          "type": [
            "object",
            "string"
          ]
        },
        "artifact_declaration": {
          "type": "string"
        },
        "effects": {
          "type": "array",
          "items": {
            "type": "string"
          }
        }
      }
    },
    "consumedContract": {
      "type": "object",
      "additionalProperties": false,
      "required": [
        "contract",
        "envelope",
        "required"
      ],
      "properties": {
        "contract": {
          "type": "string",
          "pattern": "^[a-z][a-z0-9._-]*\\.[a-z][a-z0-9._-]*(/[a-zA-Z0-9._-]+)?$",
          "description": "Full provider-namespaced contract name '<provider>.<contract>'; version resolved through the declared envelope against current provider state."
        },
        "envelope": {
          "type": "object",
          "additionalProperties": false,
          "required": [
            "op"
          ],
          "properties": {
            "op": {
              "enum": [
                "any",
                "exact",
                "at-least",
                "compatible-minor"
              ]
            },
            "version": {
              "$ref": "#/$defs/version"
            }
          }
        },
        "required": {
          "type": "boolean"
        },
        "evidence_refs": {
          "type": "array",
          "items": {
            "type": "string"
          },
          "description": "Paths or record identities holding compatibility evidence for this consumption."
        },
        "notes": {
          "type": "string"
        },
        "scope": {
          "type": "string"
        },
        "evidence": {
          "type": "object"
        }
      }
    },
    "testObligation": {
      "type": "object",
      "additionalProperties": false,
      "required": [
        "test",
        "covers",
        "obligation"
      ],
      "properties": {
        "test": {
          "type": "string",
          "pattern": "^[a-z][a-z0-9._-]*$"
        },
        "covers": {
          "type": "array",
          "minItems": 1,
          "items": {
            "type": "string",
            "description": "Provided contract name covered by this test."
          }
        },
        "obligation": {
          "type": "string",
          "minLength": 1
        },
        "invalidation_dependencies": {
          "type": "array",
          "items": {
            "type": "string"
          },
          "description": "Repository-relative files or directories that affect this declared test obligation."
        },
        "command": {
          "type": "object",
          "additionalProperties": false,
          "required": [
            "argv"
          ],
          "properties": {
            "argv": {
              "type": "array",
              "minItems": 1,
              "items": {
                "type": "string"
              }
            },
            "cwd": {
              "type": "string"
            },
            "timeout_seconds": {
              "type": "integer",
              "minimum": 1,
              "default": 900
            },
            "target_mode": {
              "enum": [
                "cargo_test_targets"
              ],
              "description": "Expand a Cargo package test declaration into bounded obligations for each Cargo target enabled for tests."
            },
            "toolchain": {
              "type": "object"
            },
            "toolchain_env": {
              "type": "string"
            }
          },
          "description": "Bounded executable validation; absent command means the obligation is satisfied by external evidence references."
        }
      }
    },
    "verificationDeclaration": {
      "type": "object",
      "additionalProperties": false,
      "required": [
        "schema_version",
        "obligation_inventory"
      ],
      "properties": {
        "obligation_inventory": {
          "type": "string",
          "pattern": "^(?!/)(?!.*(^|/)\\.\\.(/|$)).+\\.json$",
          "description": "Repository-relative path to the repository-owned obligation inventory."
        },
        "schema_version": {
          "const": "mncs-family.verification-obligation-inventory/v1"
        },
        "test_runner_identity": {
          "type": "string"
        }
      }
    },
    "producerReference": {
      "type": "object",
      "additionalProperties": false,
      "required": [
        "producer",
        "recordKind",
        "schemaVersion",
        "stableId"
      ],
      "properties": {
        "producer": {
          "type": "string",
          "maxLength": 256
        },
        "recordKind": {
          "type": "string",
          "maxLength": 256
        },
        "schemaVersion": {
          "type": "string",
          "maxLength": 256
        },
        "stableId": {
          "type": "string",
          "maxLength": 2048
        },
        "contentDigest": {
          "type": "string",
          "pattern": "^sha256:[0-9a-f]{64}$"
        }
      }
    },
    "organization": {
      "type": "object",
      "additionalProperties": false,
      "required": [
        "layout"
      ],
      "properties": {
        "layout": {
          "const": "mncs.repository-layout/1"
        },
        "surfaces": {
          "type": "array",
          "items": {
            "$ref": "#/$defs/organizationSurface"
          },
          "description": "Explicit exceptions and semantic boundaries; ordinary src/tests/docs layout need not be repeated."
        },
        "generated_regions": {
          "type": "array",
          "items": {
            "$ref": "#/$defs/generatedRegion"
          },
          "description": "Deterministic human-facing regions projected from authoritative state."
        }
      }
    },
    "organizationSurface": {
      "type": "object",
      "additionalProperties": false,
      "required": [
        "path",
        "class"
      ],
      "properties": {
        "path": {
          "type": "string",
          "minLength": 1
        },
        "class": {
          "enum": [
            "canonical",
            "compatibility",
            "differential-oracle",
            "generated",
            "historical",
            "host-boundary",
            "migration-only",
            "migration-shadow",
            "reference"
          ]
        },
        "authority": {
          "type": "string"
        },
        "note": {
          "type": "string"
        },
        "classification": {
          "$ref": "#/$defs/surfaceClassification"
        },
        "artifact_class": {
          "enum": [
            "authoritative",
            "derived",
            "mixed",
            "interpretation"
          ]
        }
      }
    },
    "surfaceClassification": {
      "type": "object",
      "additionalProperties": false,
      "required": [
        "authority",
        "lifecycle",
        "boundary_kind",
        "semantic_role"
      ],
      "properties": {
        "authority": {
          "enum": [
            "canonical",
            "compatibility",
            "reference",
            "none"
          ]
        },
        "lifecycle": {
          "enum": [
            "active",
            "temporary",
            "retired",
            "generated",
            "historical"
          ]
        },
        "boundary_kind": {
          "enum": [
            "compiler-bootstrap",
            "external-provider",
            "filesystem",
            "migration",
            "none",
            "platform",
            "process",
            "protocol",
            "storage"
          ]
        },
        "semantic_role": {
          "enum": [
            "architecture",
            "canonical-adapter",
            "canonical-host-semantic",
            "canonical-semantic",
            "compatibility-adapter",
            "differential-oracle",
            "generated",
            "historical",
            "host-bootstrap",
            "migration-shadow",
            "platform-adapter",
            "reference",
            "temporary-host-semantic"
          ]
        }
      },
      "description": "Orthogonal surface dimensions. `class` remains the v0alpha1 compatibility classifier; this object distinguishes authority, lifecycle, boundary kind, and semantic role for machine consumers."
    },
    "generatedRegion": {
      "type": "object",
      "additionalProperties": false,
      "required": [
        "path",
        "begin",
        "end",
        "source"
      ],
      "properties": {
        "path": {
          "type": "string",
          "minLength": 1
        },
        "begin": {
          "type": "string",
          "minLength": 1
        },
        "end": {
          "type": "string",
          "minLength": 1
        },
        "source": {
          "type": "string",
          "minLength": 1
        }
      }
    }
  }
}
