{
  "schema_version": "mncs-family.repository-manifest/v0alpha1",
  "repository": "mncs-harness",
  "revision": 1,
  "contracts": {
    "provides": [
      {
        "contract": "actor-provenance",
        "version": "0.1",
        "kind": "record-schema",
        "stability": "experimental",
        "fingerprint_sources": [
          "src/epi13_local_harness/actor_provenance.py"
        ],
        "consumers_declared": [
          "mncs-control",
          "mncs-commons"
        ]
      },
      {
        "contract": "experiment-stack",
        "version": "1",
        "kind": "record-schema",
        "stability": "experimental",
        "fingerprint_sources": [
          "src/epi13_local_harness/experiment_stack.py"
        ]
      },
      {
        "contract": "experiment-readiness",
        "version": "1",
        "kind": "record-schema",
        "stability": "experimental",
        "fingerprint_sources": [
          "src/epi13_local_harness/experiment_readiness.py"
        ]
      }
    ],
    "consumes": [
      {
        "contract": "mncs-fabric.public-controller-contract",
        "envelope": {
          "op": "compatible-minor",
          "version": "0.2.0a17"
        },
        "required": true,
        "evidence_refs": [
          "src/epi13_local_harness/fabric_compat.py"
        ]
      },
      {
        "contract": "mncs-commons.record-store-api",
        "envelope": {
          "op": "compatible-minor",
          "version": "0.5.0.dev1"
        },
        "required": true,
        "evidence_refs": [
          "pyproject.toml"
        ]
      }
    ],
    "tests": [
      {
        "test": "unittest",
        "covers": [
          "actor-provenance",
          "experiment-stack",
          "experiment-readiness"
        ],
        "obligation": "self",
        "command": {
          "argv": [
            "python",
            "-m",
            "unittest",
            "discover",
            "-s",
            "tests",
            "-v"
          ],
          "timeout_seconds": 1800
        }
      }
    ]
  },
  "manifest_location": "central"
}
